{
  "id": "tech/residential/voraner-v02-simple",
  "race": "tech",
  "complexGroup": "residential",
  "variant": 0,
  "footprint": [1, 1],
  "logicalWidth": 56,
  "anchor": [0.5, 0.954128],
  "shadowOffset": [0, 0],
  "emissiveOffset": [0, 0],
  "ports": [true, true, true, true, true, true],
  "layers": {
    "color": "../exports/voraner-residential-v02-color.png?v=20261001-7",
    "shadow": "../exports/voraner-residential-v02-shadow.png?v=20261001-7",
    "emissive": "../exports/voraner-residential-v02-emissive.png?v=20261001-7"
  }
}

