{
  "id": "tech/residential/voraner-v04-terrace",
  "race": "tech",
  "complexGroup": "residential",
  "variant": 2,
  "footprint": [1, 1],
  "logicalWidth": 56,
  "anchor": [0.5, 0.901585],
  "ports": [true, true, true, true, true, true],
  "layers": {
    "color": "../source/voraner-residential-v04-terrace.png"
  }
}
