{
  "id": "tech/residential/voraner-l1-3d-blockout",
  "race": "tech",
  "complexGroup": "residential",
  "variant": 0,
  "footprint": [1, 1],
  "logicalWidth": 164,
  "anchor": [0.5, 0.62],
  "shadowOffset": [0, 0],
  "emissiveOffset": [0, 0],
  "ports": [true, true, true, true, true, true],
  "layers": {
    "color": "../exports/voraner-l1-blockout-color.png?v=20261002-3",
    "castShadow": "../exports/voraner-l1-blockout-cast-shadow.png?v=20261002-3",
    "emissive": "../exports/voraner-l1-blockout-emissive.png?v=20261002-3"
  }
}
