{
  "id": "tech/industry/voraner-kaderium-forge-v02",
  "race": "tech",
  "complexGroup": "kaderium-industry",
  "variant": 0,
  "footprint": [1, 1],
  "logicalWidth": 62,
  "anchor": [0.5, 0.965],
  "shadowOffset": [0, 0],
  "emissiveOffset": [0, 0],
  "ports": [false, false, false, false, false, false],
  "layers": {
    "color": "../exports/voraner-kaderium-forge-v02-color.png?v=20261018-1"
  }
}
