{
  "id": "tech/residential/diagnostic-gold",
  "race": "tech",
  "complexGroup": "residential",
  "variant": 1,
  "footprint": [1, 1],
  "logicalWidth": 82,
  "anchor": [0.5, 0.95625],
  "shadowOffset": [0, 1],
  "emissiveOffset": [0, 0],
  "ports": [true, true, true, true, true, true],
  "layers": {
    "color": "../exports/diagnostic-gold-color.png",
    "shadow": "../exports/diagnostic-gold-shadow.png",
    "emissive": "../exports/diagnostic-gold-emissive.png"
  }
}
