{
  "id": "tech/residential/voraner-complex-3",
  "race": "tech",
  "complexGroup": "residential",
  "variant": 0,
  "footprint": [2, 2],
  "logicalWidth": 92,
  "anchor": [0.5, 0.901585],
  "shadowOffset": [0, 0],
  "emissiveOffset": [0, 0],
  "ports": [true, true, true, true, true, true],
  "layers": {
    "color": "../exports/voraner-residential-complex-3-color.png?v=20261001-7",
    "shadow": "../exports/voraner-residential-complex-3-shadow.png?v=20261001-7",
    "emissive": "../exports/voraner-residential-complex-3-emissive.png?v=20261001-7"
  }
}

