{
  "id": "tech/residential/voraner-v02-shadow-proxy",
  "race": "tech",
  "complexGroup": "residential",
  "variant": 1,
  "footprint": [1, 1],
  "logicalWidth": 110,
  "anchor": [0.5, 0.62],
  "shadowOffset": [0, 0],
  "emissiveOffset": [0, 0],
  "ports": [true, true, true, true, true, true],
  "layers": {
    "color": "../exports/voraner-v02-shadow-proxy-color.png?v=20261002-1",
    "castShadow": "../exports/voraner-v02-shadow-proxy-cast-shadow.png?v=20261002-1",
    "emissive": "../exports/voraner-v02-shadow-proxy-emissive.png?v=20261002-1"
  }
}
